{
  "slug": "ld-376",
  "version": 1,
  "status": "draft",
  "crop_slug": "rice",
  "name": "Ld 376",
  "released_by": "RRDI",
  "release_year": 2023,
  "recommended_aez_codes": [],
  "traits": {
    "recommendation": "Both Dry and Wet zones"
  },
  "field_provenance": {
    "release_year": {
      "source_id": "agrimin",
      "source_url": "https://www.agrimin.gov.lk/web/index.php/en/en/news-scroll/2158-06-07-2023-3e",
      "fetched_at": "2026-04-17T00:00:00Z",
      "quote": "Four rice varieties - Ld 376, BG 377, At 378, and BG 381 - have been introduced as high yielding rice varieties."
    },
    "expected_yield_kg_per_acre": {
      "source_id": "agrimin",
      "source_url": "https://www.agrimin.gov.lk/web/index.php/en/en/news-scroll/2158-06-07-2023-3e",
      "fetched_at": "2026-04-17T00:00:00Z",
      "quote": "Can produce 4-6 metric tons of paddy harvest per hectare from paddy cultivation in both dry and wet zones",
      "review_notes": "4–6 t/ha → 1619–2428 kg/acre."
    }
  },
  "expected_yield_kg_per_acre": {
    "min": 1619,
    "max": 2428,
    "unit": "kg/acre"
  }
}
