{
  "slug": "kalu-heenati",
  "version": 1,
  "status": "draft",
  "crop_slug": "rice",
  "name": "Kalu Heenati",
  "released_by": "Traditional heirloom (Sri Lanka)",
  "duration_days": 105,
  "recommended_aez_codes": [],
  "traits": {
    "category": "traditional_heirloom",
    "grain_shape": "medium",
    "pericarp_color": "red",
    "notes": {"en": "Husk turns black (kalu) when ripe — hence the name. Medium-sized red grains, high nutritional value, widely used in Ayurveda."}
  },
  "field_provenance": {
    "duration_days": {"source_id": "ceylon_digest_heirloom", "source_url": "https://www.ceylondigest.com/traditional-rice-varieties-of-sri-lanka/", "fetched_at": "2026-04-17T00:00:00Z", "quote": "The cultivation period of this variety is 3 ½ months.", "review_notes": "3.5 months ≈ 105 days."},
    "traits": {"source_id": "ceylon_digest_heirloom", "source_url": "https://www.ceylondigest.com/traditional-rice-varieties-of-sri-lanka/", "fetched_at": "2026-04-17T00:00:00Z", "quote": "This variety of rice has red, medium-sized grains, and the name kalu heenati is given to it because the outer husk of the grains turn black (kalu) when they ripen."}
  }
}
