{
  "slug": "bg-377",
  "version": 1,
  "status": "draft",
  "crop_slug": "rice",
  "name": "Bg 377",
  "released_by": "RRDI",
  "release_year": 2023,
  "recommended_aez_codes": [],
  "traits": {
    "recommendation": "Dry Zone"
  },
  "field_provenance": {
    "release_year": {
      "source_id": "agrimin",
      "source_url": "https://www.agrimin.gov.lk/web/index.php/en/en/news-scroll/2158-06-07-2023-3e",
      "fetched_at": "2026-04-17T00:00:00Z",
      "quote": "Four rice varieties - Ld 376, BG 377, At 378, and BG 381 - have been introduced as high yielding rice varieties.",
      "review_notes": "Release year 2023 from Ministry of Agriculture announcement covering this set of four varieties."
    },
    "expected_yield_kg_per_acre": {
      "source_id": "agrimin",
      "source_url": "https://www.agrimin.gov.lk/web/index.php/en/en/news-scroll/2158-06-07-2023-3e",
      "fetched_at": "2026-04-17T00:00:00Z",
      "quote": "Can easily be grown in dry zone and produces 6.5 metric tons of paddy harvest per hectare",
      "review_notes": "6.5 t/ha → 2630 kg/acre."
    }
  },
  "expected_yield_kg_per_acre": {
    "min": 2630,
    "max": 2630,
    "unit": "kg/acre"
  }
}
